text,x1,x2,x3,x4,x5,y
Nothing in this Paragraph 8.02(a)(2) will create an obligation on the part of FCE to grant ExxonMobil a license or right under FCE Background Patents or FCE Background Information if the Parties do not agree on the terms and conditions of such license.,252,4.8837209302,6,0,4,1
"As provided below, during the Term, the AS Parties grant to MusclePharm the right to use the Trademarks as defined in this Agreement and the Name and Appearance Rights, which shall include Endorser's name, approved photograph, approved picture (including, without limitation, any copyrighted pictures and video images of the Endorser owned by the Endorser which Endorser agrees to make available for use hereunder), approved appearance, or approved likeness, including video and other recordings of Endorser's appearance, along with the right to use Endorser's voice, including audio or other recordings of Endorser's voice, Endorser's signature, personal or professional background and experience, reputation, approved quotations and approved endorsements, or approved paraphrases of Endorser's approved quotations and endorsements, including approved touch-ups, approved simulations or approved compositions of any of the above whether generated by computer or by any other means, for the period of time and for the purposes set forth in this Agreement. MusclePharm acknowledges that the use of some works may require that MusclePharm obtain a copyright license from third parties.",1183,5.9647058824,31,2,6,1
"Upon the terms and conditions hereinafter set forth, Party A hereby agrees to grant and Party B hereby agree to accept the right to use the intellectual property in PRC.",169,4.6666666667,2,2,4,1
"Aimmune hereby grants to Xencor an exclusive license under and with respect to Aimmune Patents, and a non-exclusive license under and with respect to Aimmune Know-How, in each case, where such license is an irrevocable, perpetual, royalty-bearing license, with the right to sublicense, to Develop, Manufacture and Commercialize the Product(s), as the Product(s) exist as of the effective date of such termination, or optimized versions thereof that are Products.",462,5.7101449275,18,3,9,1
"Subject to the terms and conditions of this Agreement, Arizona hereby grants to the Company a limited, non- exclusive, royalty-free, non-sublicensable (except as set forth in Section 7.1), non-assignable license in, to and under the Arizona Licensed Trademarks for the Arizona Trademark License Term for use in the Company Field throughout the world only in the form and manner that such Arizona Licensed Trademarks are used in the Business as of the Closing, provided that the Company shall use commercially reasonable efforts to present the Arizona Licensed Trademarks in the form set forth on Schedule 6.1.",609,5.3541666667,16,2,8,1
"Subject to the terms and conditions of this Agreement, Green Cross hereby grants to MacroGenics a non- exclusive, royalty-free, perpetual license, with the right to grant and authorize the grant of sublicenses, to use all Clinical Data and any data generated by Green Cross or any of its representatives or independent contractors pursuant to its performing its responsibilities under this Agreement for the research, Development, manufacture Commercialization and sales of MGAH22 and Products by MacroGenics outside the Territory and for MacroGenics to exercise its rights and fulfill its obligations under this Agreement.",623,5.7826086957000005,10,3,7,1
"Subject to the terms and conditions of this Agreement, PcoMed hereby grants to Integra and its Affiliates a sole and exclusive worldwide right to sell and commercialize Integra Products treated by PcoMed, with the PcoMed Surface Modification Technology (the ""Right"") for use in the Field in the Territory, including the right to conduct research and development in support of any of the foregoing.",397,5.3174603175,8,1,4,1
"Subject to the terms and conditions of this Agreement, MacroGenics hereby grants to Green Cross an exclusive, royalty- bearing (i) license, with the right to grant sublicenses (subject to Section 10.1(b)), under the MacroGenics Licensed Technology and the MacroGenics Licensed Trademarks; and (ii) to the extent needed under this Section 10.1(a), sublicense under the MacroGenics Licensed Technology licensed pursuant to the Upstream Agreements, in the case of each of (i) and (ii), to conduct the Phase I Clinical Development Plan and Phase II Clinical Development Plan, and to distribute, sell, offer for sale and import Products in the Field in the Territory during the Term.",678,5.4666666667,29,2,10,1
"Roche hereby grants to FMI a non-exclusive, royalty-free, worldwide, perpetual, and sublicensable license to any IP Controlled by Roche and developed under the ctDNA Platform Development Program (excluding Roche Immunotherapy Sample Results) to the extent necessary for FMI to research, develop, make, have made, use, offer for sale, sell, import and commercialize the ctDNA Assays.",382,5.9636363636,16,1,3,1
"Subject to the terms and conditions of this Agreement including Article 12 above, FG hereby grants to Astellas an exclusive license under the FG Technology to: use, package, sell, have sold, import, market and otherwise distribute the Lead Compounds for use solely in the Field in the Astellas Territory",303,5.2040816327,7,1,2,1
"Subject to the terms of this Agreement, subject to Manufacturer meeting EMV's requirements for quality, price and lead- time, EMV hereby grants Manufacturer an exclusive, non-transferable, license (without the right to sublicense) under EMV's Proprietary Rights in the Territory, during the term of this Agreement, to copy the EMV firmware as may be provided by EMV from time to time onto Product units in the manufacturing process at each EMV-approved Manufacturer manufacturing facility.",489,5.7123287671,15,1,5,1
"In the event of a Supply Failure, Miltenyi shall grant Bellicum's Second-Source Supplier a limited, non-exclusive, non-transferable, one-site production license, without the right to sublicense, under Miltenyi's Intellectual Property Rights solely to the extent reasonably necessary to manufacture the Affected Miltenyi Product for the Permitted Use by Bellicum at Bellicum's cost.",381,6.4901960784,14,1,8,1
"Subject to the terms and conditions of this Agreement, Commerce One grants to Corio a nonexclusive, nontransferable (except in accordance with Section 14.1 of this Agreement), royalty-free, fully paid up, perpetual right and license in the Territory to reproduce, install and use additional copies of the Software and Software tools and utilities, subject to any restrictions placed on the Commerce One by third party software providers, in machine executable object code for (i) Corio's internal business operations and (ii) production, testing, development, upgrade, reporting and training.",592,5.8953488372,22,0,3,1
"Kitov hereby grants to Dexcel a fully paid, limited, non exclusive, license to use Kitov Data in as much as required for the provision of the Services by Dexcel.",161,4.5862068966,4,1,2,1
"Network hereby grants to Affiliate the exclusive right via Broadcast Television, and Affiliate hereby accepts such exclusive right and the obligation during the Term to broadcast the Service via Broadcast Television (i) over the transmission facilities of each Station identified on Exhibit A, which is licensed by the FCC to serve the community for each such Station (the ""Licensed Community""), for receipt by TV Households in the DMA in which the Licensed Community is located, as such DMA is identified on Exhibit A, and (ii) over the transmission facilities of any Acquired Station, except to the extent that, as of the date Affiliate notifies Network in writing of its binding agreement to acquire such Acquired Station, (A) another Broadcast Television station in the same DMA as the Acquired Station has exclusive rights to broadcast the Service, or (B) the Acquired Station is obligated to broadcast other material that precludes it from also carrying the Service.",972,5.2774193548,22,2,9,1
"Subject to the terms and conditions set forth herein, World Book hereby grants to HSWI, a perpetual, irrevocable limited license to use, copy, store, archive, distribute, transmit, modify (subject to Section 2.1(iv)), and Display the Content, Images and Affinities in whole or in part, only on the HSWI Websites or in promotions in any media for the HSWI Websites.",364,5.186440678,18,2,1,1
"PlanetCAD hereby grants to Dassault Systemes a fully-paid, non-exclusive, worldwide, revocable limited license to the Server Software and Infrastructure for the sole purpose of (i) hosting the Co-Branded Service and (ii) fulfilling its<omitted>obligations under this Agreement.",277,6.7222222222,11,2,2,1
"Upon the release of the Source Code to Corio pursuant to Section 12.2 of this Agreement, Corio shall have a royalty-free, nonexclusive, nontransferable, right and license at its head office to use and modify the Source Code to support and maintain the Software until the expiration or termination of Corio's Customers' License Agreements for the Corio Services.",361,5.350877193,9,2,4,1
"Pey Dirt grants to Company the exclusive right and license to use Manning Identification within the Contract Territory during the Contract Period in connection with the advertisement and promotion by Company of Products in television, radio, print and point of purchase.",270,5.6097560976,3,0,3,1
"Distributor hereby grants Zogenix an irrevocable, perpetual, world-wide, royalty-free, fully paid-up, non-exclusive license with the right to grant sublicenses under such Distributor Inventions and any patents or patent applications claiming or disclosing such Distributor Inventions.",284,7.1428571429,10,1,6,1
"iBio hereby grants to CC-Pharming for the term of this Agreement, a nonexclusive, non- assignable, non-sublicensable, limited right and license to use iBio's Technology in order to manufacture, process, prepare, and obtain regulatory approval for the development and production of Product(s) and work to be performed under this Agreement.",338,5.9183673469,14,1,2,1
"Customer grants to Philips, during the Term, a non-exclusive, royalty-free, non-transferrable right to make, have made, use, sell, reproduce, adapt, distribute, or otherwise use or practice Customer's Intellectual Property Rights solely in connection with manufacturing of the Products and packaging to Customer pursuant to this Agreement.",339,6.3913043478,16,1,6,1
"non-exclusive, and we therefore have the right, among other things: 9.3.6.1 To use the Proprietary Marks ourselves in connection with selling Services and products; 9.3.6.2 To grant other licenses for the Proprietary Marks, in addition to licenses we may have already granted to existing franchisees; and Page 22 of 80 9.3.6.3 To develop and establish other systems using the same or similar Proprietary Marks, or any other proprietary marks, and to grant licenses or franchises for those other marks without giving you any rights to those other marks. 9.4 Change to Marks",572,5.2282608696,20,0,6,1
"With respect to any Intellectual Property developed by BLI or its Affiliates in collaboration or on behalf of a Third Party during the Term of this Agreement that is [***] for (a) [***] or (b) [***], with respect to each, BLI and its Affiliates shall [***] to [***] that BLI or its Affiliates Control such Intellectual Property so that BLI may grant a license to Ginkgo with respect to such Intellectual Property as set forth in Section 9.1 (Grants to Ginkgo).",460,4.6913580247,10,1,8,1
"During the Term of this Agreement MLX shall:<omitted>c) grant to HCI, a non-exclusive and non-transferable right to use MediaLinx images and certain content contained in the HealthyWay web site (the ""Sympatico Content"") for the sole purpose of satisfying the requirements of this Agreement. MediaLinx shall retain all right, title to and interest in the Sympatico Content; d) grant to HCI, to the extent that HCI requires access to MLX logos and trademarks (collectively ""MLX Marks"") the use of certain MLX Marks as necessary for the purposes of fulfilling its obligations under this Agreement.",594,5.3978494624,19,3,5,1
"More particularly, said right and license to practice FCE Background Information and FCE Background Patents for Generation 2 Technology in any application outside of Carbon Capture Applications and Hydrogen Applications will include the right to use, reproduce, and create derivative works of FCE Background Information under applicable copyrights and the right to make, use, import, and sell or offer to sell under the claims of FCE Background Patents.",453,5.6764705882,7,0,4,1
"The rights granted herein include the limited license to use the Trademarks of the Franchisor (the details of which are morefully set out in Exhibit A), as set out in Section 3 of this Agreement, for the purposes of establishing and operating the Smaaash Centres in the Territory.",280,4.8541666667,5,1,3,1
Valeant shall have the non-exclusive right to use the Dova Trademarks and Copyrights solely on Product Materials in order to perform the Valeant Activities and solely in accordance with the terms and conditions of this Agreement.,229,5.3888888889,2,1,2,1
"The Step-in Right shall include, without limitation, and to the extent allowable under Applicable Law, PPI's grant to EKR of such additional license rights, rights of access, rights of observation and rights of management, direction and control, in each case solely with respect to the manufacture and supply of Product and as reasonably necessary to enable and permit EKR (or EKR's designee) to ensure that the supply of Product shall continue to be available to EKR under this Agreement and the Supply Agreement; provided that EKR in exercising the Step-in Right shall not (i) unreasonably interfere with PPI's other activities at the facilities at which the Product is manufactured, tested, labeled, stored or<omitted>otherwise handled (""Product Facilities"") or (ii) require PPI to take any action or fail to take any action that does or could reasonably be expected to interfere with PPI's other activities at the Product Facilities.",937,5.380952381,28,3,8,1
Agent is granted a limited license and right to use all Intellectual Property for purposes of conducting the GOB Sale and otherwise marketing any or all of the Assets;,167,4.7931034483,1,0,5,1
"Subject to the terms and conditions of this Agreement: (a) i-Escrow hereby grants to 2TheMart a non-exclusive, nontransferable right to use the i-Escrow Marks (including without limitation the Domain Name) in links to and advertisements and promotions for the Co-Branded Pages or the Services; and (b) 2TheMart hereby grants to i-Escrow a non-exclusive, nontransferable right to use 2TheMart Marks (including without limitation the Domain Name) on the Co-Branded Pages, and for the performance of Services.",506,5.76,21,2,4,1
"Aucta, for itself and its Affiliates, hereby grants to ETON in accordance with the terms and conditions of this Agreement, an exclusive (even as to and against Aucta in the Territory) right and license, including the right to sublicense, to the Products (or any components thereof), Dossiers, and all current and future Aucta Background Intellectual Property that is owned or controlled by Aucta or its Affiliates for ETON to develop, manufacture, import, use, promote, distribute, market, advertise, offer for sale or sell (collectively, ""Market"") the Products in and for the Territory.",587,5.4615384615,25,2,7,1
"Subject to the terms and -------------------------------- conditions of this Agreement, NTL, to the extent of its legal right to do so, hereby grants to Entrust under the Nortel Patents, a non-transferable, non- assignable, indivisible, non-exclusive, royalty-free, worldwide license for Licensed Products and Licensed Services.",328,6.4772727273,46,1,6,1
"Subject to the terms and conditions of this agreement, Channel Partner grants to you a royalty-free, non-exclusive, non-transferable, limited license right exercisable solely during the term of this agreement to: (1) reproduce, exactly as provided by Channel Partner, object code copies of the Client Software, as needed for distribution to your End Users the iPass Software; and to install and use the iPass Licensed Software.",427,5.5846153846,15,0,5,1
"Subject to the terms and conditions of this Agreement, World Book grants HSWI the right to use, copy, store, archive, distribute, transmit, modify, translate (subject to Section 2.3), and Display the Content that comprises the Affinities as part of the Affinities, and the Affinities themselves, in any manner and in any digital media (and to sublicense such rights to third parties), provided that HSWI does not resell all or license substantially all of the Content for a fee to other content publishers.",506,5.1829268293,18,0,4,1
"CytoDyn hereby grants to Vyera, and Vyera hereby accepts, an exclusive royalty-bearing license (or sublicense, as the case may be), under the CytoDyn Patents, the CytoDyn Know-How and the Inventions (if any) solely to Commercialize, use, have used, offer for sale and sell Licensed Products in the Field in the Territory.",321,5.3137254902,15,2,5,1
"Each party hereby grants to the other a non-exclusive, limited ------- license to use its trademarks, service marks or trade names only as specifically described in this Agreement.",180,5.4642857143,11,1,2,1
"THC and/or HSI will retain ownership and will grant a royalty-free, non-exclusive license to HERC to use such Other Intellectual Property for the Interim Period, as more fully set forth in the Trademark, Trade Name, Domain and Related Rights License Agreement attached as Exhibit A.",282,5.2888888889,7,0,9,1
"Subject to the terms set forth in this Agreement, North hereby grants to Company the right and privilege to use North's Likeness and North's Endorsement during the Term and within the Contract Territory in all reasonable forms of advertising including, but not limited to television (including the infomercial format), radio, print advertising, brochures, pamphlets, product packaging, point-of-purchase materials, Company's web-site and a demonstration video (hereinafter referred to as ""Advertising Materials"") in connection with Company's advertisement and sale of the Endorsed Product only.",594,6.256097561,23,1,1,1
"Licensor grants to Licensee a limited, non-exclusive, non-transferable (except as provided in Section 11.7) and non-sublicensable royalty-free license during the Term to those of Licensor's Marks designated by Licensor from time to time to: (i)display such Marks on the Licensee Site: (x) with the Licensed Content to provide source attribution; or (y) as links to the Licensed Content; (ii)comply with its express obligations under this Agreement; and (iii)advertise, market and promote the availability of the Licensed Content or the Licensee Site and identify the Licensor as a content provider; provided, that all uses of Licensor's Marks shall require Licensor's prior written approval.",691,5.7843137255,31,2,15,1
"Dynamic Hearing grants to IntriCon in accordance with this Agreement, for the Term, a license, to Use Dynamic Hearing's Technology, Software and Documentation developed as of the Commencement Date to manufacture, import, sell and offer for sale throughout the Territory, Products containing Dynamic Hearing's Technology and Software.",333,6.1063829787,10,0,1,1
"Upon expiration of this Agreement, the licenses granted to Ono under Section 2.1 shall become non-exclusive, fully paid- up, irrevocable, perpetual, royalty free licenses, with sublicensing rights, to Develop, Manufacture, and/or Commercialize the Products in the Ono Territory.",278,6.3421052632,13,1,4,1
"Except as may be otherwise specified in its Trademark Consent, during the Term and subject to Section 9.02.5, the terms and conditions of the Trademark Consent and the Trademark License Terms, each of the PHL Parties or its Affiliates, as applicable, shall grant to ICC and their Affiliates, as applicable, a non-exclusive - 17 - limited license (a ""License"") to use the PHL Licensed Marks solely in connection with the performance of the duties and obligations of ICC and its Affiliates, as applicable, under the Transaction Documents.",536,5.1724137931,19,2,9,1
"For clarity the grant of any license under any Invention or assignment of any Invention by either Party does not include any license under any of such Party's Background IP, even where such Background IP dominates or encompasses any Invention.",243,5.1,3,1,3,1
"The parties acknowledge and agree that, as between the parties, all right, title and interest in and to the trademark or service mark ""APPLY,"" as it relates to the APPLY software product, shall be and remain the sole and exclusive property of Certegy; provided, however, that Certegy shall grant to Equifax a perpetual, fully paid, world-wide, exclusive license to use the ""APPLY"" trademark or service mark solely for use in combination with the mark ""Equifax"" and solely in connection with the use of the APPLY software PRODUCT.",529,5.091954023,19,2,8,1
"The Professional grants to the Company the exclusive worldwide right and license to use his name, autograph, likeness, photographs, electronic media depiction, signature and any other words, symbols or depiction's which would identify the Professional to the public in connection with the advertising, promotion, publicizing, sale and distribution of Haley apparel by the Company.",380,6.0555555556,11,0,3,1
"Each Party shall own rights to any Internet domain names incorporating the Product Trademark(s) owned by such Party under Section 12.1 or any variation or part of such Product Trademark(s) as its URL address or any part of such address, and agrees to grant, and hereby grants to the other Party a royalty-free, fully paid-up exclusive license to use those particular Internet domain names which the grantee Party elects to use (and actually uses) in connection with the grantee Party's commercialization of the applicable Product in the grantee Party's Territory in accordance with this Agreement.",597,5.2947368421,15,2,7,1
"Subject to the terms and conditions of this Agreement, Zynga grants to WPT a non-exclusive, non- assignable, non-sublicensable, royalty-free, paid up, limited worldwide license to use and display Zynga's Licensed Property solely as necessary to perform WPT's obligations under this Agreement and as specifically described on Exhibit A, in any and all media now known or hereafter devised, for the Term (subject to Section 7.e. of Additional Provisions).",453,5.6764705882,19,2,5,1
"In the event that CAPSUGEL reasonably determines that the development of the Compound Formulation is not feasible with Commercially Reasonable Efforts in accordance with the Development Plan, with such changes as reasonably requested by CAPSUGEL, then CAPSUGEL may discontinue the development of the Compound Formulation and Product and terminate this Agreement, in which case, CARDAX shall have the right to license the Intellectual Property Rights as provided in Section 4.",475,5.8,5,1,5,1
"Subject to the terms and conditions of this Agreement, NCM hereby grants to Network Affiliate, and Network Affiliate hereby accepts, a non-exclusive, non-transferable, non-sublicenseable, royalty-free limited license to the object code version of the Software on Equipment at Theatres solely for the limited purpose of performing this Agreement.",345,6.2083333333,11,2,3,1
"Effective as of the Initial Closing Date the Seller hereby grants (and will cause each other Seller Party to grant, following each applicable Closing Date), to the Purchaser Licensees an irrevocable (except as expressly set forth herein), non-sublicenseable (except as expressly set forth herein), perpetual, fully paid-up, royalty-free, worldwide, non-transferable (except as expressly set forth herein), non-exclusive license, under the Licensed IP (other than Trademarks and Patents): (i) (A) to use such Licensed IP in the operation of the Business and to practice any methods, processes, and procedures in connection therewith and (B) to make, have made, use, sell, offer for sale, import, and otherwise dispose of products, services, and systems that were designed, developed, manufactured,<omitted>distributed, offered for sale, sold, resold, supported, otherwise under development, or provided, as of the applicable Closing Date, by the Seller Entities in connection with the Business and to practice any methods, processes, and procedures in connection therewith, and in each case of clauses (A) and (B), including with respect to all Derivative Works and natural evolutions thereof; and (ii) to make, have made, use, sell, offer for sale, import, and otherwise dispose of Smart Sensing Network Equipment.",1314,5.8134715026,71,6,6,1
"XC does hereby grant AJR a limited and non-transferable license and non-exclusive right to use XC's logo and trademarks and service marks set forth on Schedule A attached hereto (the ""Licensed Materials"") during the Term of this Agreement.",239,5.3157894737,8,1,5,1
"In addition, Diversinet hereby grants to Reseller the right to use those Diversinet trademarks and copyrighted materials with respect to the Products solely for the purpose of marketing and distribution of the Products as authorized hereunder.",243,5.7777777778,2,2,1,1
Kallo grants to Agent the non-exclusive and non-transferable right to distribute the use of the Kallo Mobile care suite of products to commercial end user customers.,165,5.3846153846,3,0,2,1
