text,x1,x2,x3,x4,x5,y
"LeadersOnline hereby grants VerticalNet a non- exclusive, nontransferable, royalty-free right and license for the Term of this Agreement to use, copy or modify the LeadersOnline Mark, text describing LeadersOnline and the URL address of the LeadersOnline Site for the design and display of the LeadersOnline Employer Spotlights, provided, VerticalNet shall not alter the appearance of the LeadersOnline Mark without the consent of LeadersOnline.",445,6.0793650794,9,2,4,1
Distributor shall not sell or export the Products outside the United States without prior written consent of Erchonia.,118,5.6111111111,1,1,0,1
"TL hereby grants to Integrity the right to use its ""TL Music"" name and logo (""the TL Trademarks"") in connection with the products produced during the Term of this Agreement for as long as the parties continue to sell and distribute such products at no additional cost to Integrity, and in accordance with the terms and conditions contained herein.",347,4.8983050847000005,8,2,1,1
"Without limiting the foregoing, but subject to the restrictions set forth in Section 2.5 hereof, Bank of America may: (x) sublicense its rights granted herein to its third party contractors for the purpose of their performing services for Bank of America and its Affiliates (which services may include, without limitation, altering, modifying, enhancing and improving the Software and creating derivatives to the Software), provided that such third party contractors have entered into a written agreement containing commercially standard confidentiality provisions requiring them to maintain the Source Code to the Licensed Programs securely and in confidence (subject to commercially standard exceptions), prior to having access to the Source Code for the Software: (y) sublicense its rights in the Software excluding any rights in the Source Code, to its end user customers as necessary for Bank of America to provide services to such end user customers; and (z) host the Software on its systems (or allow a third party to host the Software on its behalf) and make the Software available for use by its end user customers through the internet or other similar means.",1168,5.3879781421,26,3,7,1
"Depomed agrees to grant and hereby grants to King an exclusive option (exercisable at King's sole discretion by providing written notice of intent at any time, but in no event later than 180 days after the Effective Date) to obtain an exclusive license in the Territory to certain of Depomed's proprietary drug delivery technology in combination with both metformin hydrochloride and any other active pharmaceutical ingredients (a ""Combination Product License"").",462,5.6142857143,10,2,5,1
"Subject to the terms and conditions and in consideration of the payments set forth herein and in the Primary Agreement, CSA as disclosed agent for Talent grants to Company from the Commencement Date the right and license during the Term of this Agreement in the Territory to use the ""Property"" in connection with the advertisement, promotion, and sale of the Property Training Course and the Product as well as the right to use such Property on the Product and related packaging.",479,4.9259259259,6,1,6,1
"IBM grants Customer an irrevocable, nonexclusive, worldwide, paid-up license to use, execute, reproduce, display, perform, and distribute, within Customer's Enterprise only, copies of Type II Materials.",202,6.8076923077,13,0,1,1
"Subject to Section 14.1.1, title to all inventions and other intellectual property made related to (i) the Development Program, (ii) the Lead Compounds, (iii) FG Technology or FG Confidential Information, (iv) the Field, or (v) the Expanded Field (subsections 14.1(i)-(v), collectively, the ""Protected Field"") shall be owned by or is hereby assigned to FG; provided, however that Astellas shall own inventions of general applicability relating solely to drug delivery systems created exclusively by Astellas under subsection 14.1(i), excluding inventions related to or based on subsections 14.1(ii), (iii), (iv), or (v), and provided, further, that Astellas hereby grants to FG a worldwide, fully paid non-exclusive license with the right to sublicense to practice such inventions with respect to the FG Technology.",815,5.8,53,4,6,1
"MD Anderson hereby grants LBIO a non-exclusive, royalty free, perpetual license (with rights to sub-license) under, in and to all Background Intellectual Property that is: (a) owned by MD Anderson; (b) consists of and/or comprises the manufacturing protocol utilized by MD Anderson in the conduct of a Study; and (c) reasonably necessary to exploit (including developing, obtaining and maintaining regulatory approval for, manufacturing, or commercializing) any Invention, Study result, or Study article, or any improvement or derivative thereof, strictly limited to the Fields (collectively, the ""Non-Exclusively Licensed MD Anderson Background Intellectual Property""), to the extent that such Non- Exclusively Licensed MD Anderson Background Intellectual Property does not include Third Party IP (as defined hereinafter).",823,6.2280701754,36,2,13,1
"It being understood and agreed that Bizzingo shall have the right to exhibit commercials, infomercials, advertisements and otherwise make use of all Property on a worldwide basis and that Bizzingo and its affiliates shall be the sole owner of all commercials, promotional materials and other items produced or created hereunder and all related rights worldwide, including, without limitation, copyright, trademark and intellectual property rights, subject however to the terms and conditions herein.",499,5.9444444444,9,4,8,1
"In the event Cargill (i) is unable to achieve a given milestone described in Section 2.3 by the Target Date, or (ii) terminates this Agreement pursuant to Section 10.2, Bioamber shall have the option to obtain a license during the term of this Development Agreement to the patent applications and patents listed in Exhibit B (including any continuations, continued prosecutions, continuations- in-part, reissues, reexaminations, divisions or substitutions thereof) (collectively ""Licensed Patents""), the tool kit listed in Exhibit C (""Licensed Tool Kit""), and Cargill Improvements if any (as defined in Section 5.2 below), for research use only and for additional monetary consideration (""Research License"").",708,5.8834951456,36,3,5,1
"In order to operate your Franchised Business under this Agreement, we hereby license use of such data back to you, at no additional cost, solely for the term of this Agreement and for your use in connection with operating the Franchised Business.",246,4.880952381,4,1,1,1
"HSI will retain ownership and will grant a royalty-free, non-exclusive license to HERC to use the HSI (HERTZ) Foreign ERB Trademarks (those foreign trademarks owned by HSI related to the ERB that incorporate the mark/name HERTZ) as set forth on Schedule A, for the Interim Period, outside the United States and Puerto Rico, as more fully set forth in the Trademark, Trade Name, Domain and Related Rights License Agreement attached as Exhibit A.",444,5.095890411,13,0,7,1
"The licenses granted in Articles 3.01 to 3.04 of this IP Agreement are subject to a reserved non-exclusive license in the Company to practice the methods described and claimed in the Patents and to make, have made, use, offer to sell, sell and import rare earth products made using such methods, and to use the Technical Information to practice the methods described and claimed in the Patents for such purposes. Such reserved non-exclusive license shall be solely for use by the Company and its Affiliates and shall not be transferable to any Third Party, except in connection with a merger, consolidation, or the sale or transfer of substantially all of the Company's assets associated with the performance of this IP Agreement.",730,5.041322314,15,2,5,1
"During the Term of this Agreement, the AS Parties grant to MusclePharm and consent to MusclePharm's commercial use of the Name and Appearance Rights to advertise, promote, endorse and publicize Products, Licensed Products, and MusclePharm's business, worldwide in any media selected by MusclePharm (excluding telephone or texting campaigns), including but not limited to print, radio, television, electronic, wireless or internet, pursuant to the terms and conditions set forth herein. MusclePharm acknowledges that any use on products requires approval and that use of the Name and Appearance Rights on products is limited to the Licensed Products.",649,5.8421052632,18,2,5,1
"The Association Marks shall not be placed adjacent to the mark of another organization concerned with diabetes, or those of a company that manufactures products or provides services related to diabetes, without the Association's specific prior written consent, which may be withheld for any reason.",298,5.6444444444,5,1,0,1
"XENCOR hereby grants to BII and BII herewith accepts a non exclusive, worldwide, irrevocable, sublicensable (in several cascades), perpetual, royalty-free/fully paid up license under the XENCOR Intellectual Property to the extent it is generally applicable to the manufacturing of biopharmaceutical products, handling<omitted>of cell lines and/or development of manufacturing processes, to use such XENCOR Intellectual Property in for the manufacture of biopharmaceutical products, handling of cell lines and/or development of manufacturing processes, but excluding any use with respect to the Product (or any modification, derivative or fragment thereof).",656,6.5517241379,16,2,7,1
"All data pertaining to, derived from, or displayed at the Franchised Business (including without limitation data pertaining to or otherwise about Franchised Business customers) is and shall be our exclusive property, and we hereby grant you a royalty-free non-exclusive license to use that data during the Term of this Agreement.",329,5.6,8,2,6,1
"Licensor hereby grants to Licensee a non-exclusive right to use the trademarks, service marks, trade names, copyrights, logos and designations (collectively, the ""Marks"") relating to the Licensed Products or the Documentation during the term of this Agreement in the marketing by Licensee of the Licensed Products, provided that such Marks clearly indicate Licensor as the owner of the Marks whenever the Licensed Product or Documentation is first mentioned in any written material referencing the Licensed Product and the proper symbol is used in a superscript following the Marks.",582,5.625,12,1,10,1
"Any display of Association Mark must be accompanied by one of the following relationship statements: a. ""Freeze Tag is a national sponsor of Get Fit Don't Sit DayTM, a wellness engagement day of American Diabetes Association®"" b. ""Freeze Tag is a national sponsor of American Diabetes Association®""",298,5.3617021277,9,0,0,1
"For clarity and without limiting Section 8.8.1 (Non-Exclusive Manufacturing License; Covenant), the licenses granted to Ginkgo in Section 9.1.1 (Scope of Grants) and Section 9.1.2 (License Grant to Exploit [***]) do not include the right to make, have made, offer to sell or sell Consumables, [***], to or for Third Parties or any Ginkgo Affiliate or Ginkgo Subcontractor that are [***] on the Beacon Platform [***].",416,5.3181818182,20,0,6,1
"The licenses granted under this Subsection 2.1(b) may be sublicensed by Ono only to its Affiliates, and then only for so long as such entities remain as Affiliates. For clarity, the licenses granted under this Subsection 2.1(b) may be extended by Ono to Third Party manufacturers for Manufacturing the Products on Ono's behalf.",327,5.1886792453,11,0,2,1
"Upon and subject to the terms and conditions stated in this Agreement, on the Effective Date, for the consideration described in this Agreement and Eutectix's performance of its other obligations under this Agreement, Liquidmetal grants to Eutectix the right and license to use the following equipment owned by Liquidmetal (the ""Licensed Equipment"") (i) solely for use on Liquidmetal's behalf, (ii) for Eutectix's own limited use in the production of Liquidmetal Products (as defined below) or Licensed Products (as defined below), (iii) for the continued development of applications utilizing bulk metallic glasses in cooperation between Liquidmetal and Eutectix, and (iv) independently by Eutectix pursuant to the terms of this Agreement: (a) Two (2) Engel e-motion 310/120 injection molding machines, and associated equipment; (b) Two (2) Eontec 300-C Die Casting Machines, and associated equipment; (c) One (1) Flow M21313B Waterjet Machine; (d) Two (2) DMG Mori Milltap 700 CNC machines, and associated consumables and fixtures; (e) Equipment for cut, mount, and polish analysis operations, including: i. One (1) Struers Accutom-10 cut-off machine ii. One (1) Struers Secotom-50 precision cutting machine iii. One (1) Struers Tegramin-30 tabletop grinding machine iv. One (1) Keyence VH X-S550E microscope (f) Equipment required for vibratory deburring operations, including: i. One (1) Rosler R 125 EC-KF rotary vibrator ii. One (1) Rosler R 125 EC rotary vibrator 2<omitted>(g) Equipment required for passivation operations, including: i. One (1) ESMA, Inc. E782C ultrasonic cleaning system (h) One (1) Dry Cooler D455 chill water system; (i) One (1) MTS 810 MTS mechanical testing frame; and (j) Molds and fixtures needed for production of sample parts.",1761,5.6742424242,107,3,4,1
All Derivative Works are hereby licensed back to EFS subject to the limitations that are applicable hereunder to the Playboy Content.,133,5.380952381,1,2,1,1
"Franchisee agrees and grants to Pretzel Time and its Affiliates a perpetual and worldwide right to use and authorize other Pretzel Time Units or other food service businesses operated by Pretzel Time or its Affiliates, franchisees and designees to use such ideas, recipes, formulas, concepts, methods, and techniques relating to the development and/or operation of a dessert or snack food business.",398,5.5409836066,7,0,1,1
"HealthGate hereby grants to the Publishers a non-exclusive non-transferable licence to use the Proprietary Software for the purposes of this Agreement Save in relation to the Publishers' logos, trademarks, and content, HealthGate may use and/or licence the Proprietary Software for itself or for others without any compensation or liability to the Publishers.",359,5.9230769231,7,1,1,1
"Hence, as of the Distribution Date, SpinCo hereby grants, and agrees to cause the members of the SpinCo Group to hereby grant, to Honeywell and the members of the Honeywell Group a non-exclusive, royalty-free, fully-paid, perpetual, sublicenseable (solely to Subsidiaries and suppliers for ""have made"" purposes), worldwide license to use and exercise rights under the SpinCo Shared IP (excluding Trademarks and the subject matter of any other Ancillary Agreement), said license being limited to use of a similar type, scope and extent as used in the Honeywell Business prior to the Distribution Date and the natural growth and development thereof.",647,5.48,21,3,6,1
"During the term of this Agreement, Detto shall have the right to use and reproduce the Trademarks in connection with Detto's marketing, advertising, promotion and distribution of Qwik-Fix Pro.",192,5.6551724138,6,1,1,1
"Subject to the terms and conditions of this Agreement, Todos hereby grants Reseller a limited license to use the Todos name and Todos's trademarks, trade names, service marks, logos and related symbols (the ""Todos Marks"") in the performance of its activities hereunder and in the marketing of the Products in the Territory.",323,5.2307692308,10,2,1,1
"Subject to the terms and conditions of this Agreement, Arizona hereby grants to the Company a perpetual, non- exclusive, royalty-free license in, to and under the Arizona Licensed Know-How for use in the Company Field throughout the world.",239,5.3157894737,8,1,4,1
"If CERES informs IGER in writing that CERES is planning to commercialize the LICENSED VARIETY in all or part of the COUNTRY, directly or indirectly (whether or not through the third party identified by IGER), and CERES has not taken reasonable steps towards the implementation of such commercialization within two (2) years after so informing IGER, unless CERES informs IGER of REASONABLE GROUNDS for its failure or delay<omitted>to implement commercialization plans, IGER will be granted a non-exclusive license with the right to grant sublicenses to test, produce and sell the LICENSED VARIETY in the COUNTRY.",611,5.4421052632,11,0,7,1
"Subject to the terms and conditions of this Agreement, RevMed hereby grants to Sanofi an exclusive (even as to RevMed and its Affiliates), royalty-bearing license (which shall be sub-licensable solely as provided in Section 3.4) under the RevMed Licensed Technology, to Research, Develop, Manufacture, use, sell, offer for sale, import and otherwise Commercialize and exploit Products (including, for clarity, any Companion Diagnostics with respect to such Products) in the Field in the Licensed Territory.",506,5.8513513514,21,2,5,1
"In the event that Zogenix is the holder of the Regulatory Approval for the Product in the Territory at the time of termination pursuant to Section 12.2(c) by Zogenix or Section 12.2(d) by Distributor or expiration pursuant to Section 12.1, such license agreement shall also include a grant by Zogenix to Distributor of the right to reference and use all Data and Regulatory Filings (including all Regulatory Approvals), such reference and use solely for maintaining Regulatory Approval and commercializing the Product in the Territory in the Field.",548,5.3103448276,12,3,3,1
"Certegy hereby grants, and will cause each member of the Certegy Group to grant, to Equifax and each member of the Equifax Group a fully paid, non- exclusive, worldwide, non-<omitted>transferable right to continue to use the Marks that were owned immediately prior to the Distribution Date by a member of the Certegy Group and employed in the Equifax Business, but only to the extent such Marks were displayed by the Equifax Group prior to the Distribution Date (i) on assets owned by Equifax or any member of the Equifax Group (other than the Transferred Assets), (ii) on premises jointly occupied with one or more members of the Certegy Group, and (iii) on letterhead, product and services documentation, invoices, software programs, packaging and similar materials used by the members of the Equifax Group, and such Marks are used in accordance with the same guidelines for usage as the Equifax Marks as described in subsection (a) above.",941,5.0774193548,26,1,3,1
"TL will hold exclusive worldwide rights to promote and sell the product through the following distribution channels: Outgoing telemarketing, General Market retail, and General Market catalogs, and exclusive rights within the United States for Television Direct response.",270,6.3243243243,5,0,4,1
"Astellas shall have access to and the right to use solely for the purpose of this Agreement, any Data developed by or on behalf of FG or its Affiliates or Sublicensees with respect to Lead Compounds in connection with the Field (i) to the extent necessary to support the application to the regulatory authority in the Astellas Territory or to fulfill other Japanese Ministry of Health, Labor and Welfare regulatory requirements, or (ii) if not necessary to support such application or to fulfill such Japanese Ministry of Health, Labor and Welfare regulatory requirements, to the extent FG is permitted subject to FG's third party obligations; provided that FG shall [ * ] negotiate the availability of such Data to Astellas from such Sublicensee, and provided, further, that Astellas agrees not to use or disclose to third parties any such data for purposes outside the Field except as authorized under this Agreement.",919,5.0927152318,15,3,1,1
"Party A and Party B shall sign the Contract for Technology Investment simultaneously with the signature of this Contract, and pursuant to the Contract for Technology Investment shall license to the Joint Venture Company the right to utilize proprietary technology (including patented technology), related documentation and know-how for the production of the Joint Venture Products.",381,5.9454545455000005,6,3,2,1
"Vendor hereby grants and promises to grant and have granted to AT&T and its Affiliates a royalty-free, nonexclusive, sublicensable, assignable, transferable, irrevocable, perpetual, world- wide license in and to any applicable Intellectual Property Rights of Vendor to use, copy, modify, distribute, display, perform, import, make, sell, offer to sell, and exploit (and have others do any of the foregoing on or for AT&T's or any of its customers' behalf or benefit) any Intellectual Property Rights of Vendor or any third party that are not included in Material or Paid-For Development but necessary to operate the Cell Sites or receive the full benefit of the Work.",667,5.3619047619,25,1,10,1
"Subject to the terms and conditions of this Agreement, as of the Distribution Date, SpinCo hereby grants to Nuance and the members of the Nuance Group a worldwide, non-exclusive, fully paid-up, perpetual and irrevocable, transferable (subject to ARTICLE VIII), sublicensable (subject to Section 4.01(g)) license to continue to use any SpinCo IP (other than SpinCo Patents, SpinCo Technology Assets, SpinCo Trademarks, SpinCo Domain Names and SpinCo Data), in each case solely as and to the extent that it is used by the Nuance Group in connection with products and services of the Nuance Business within the Nuance Field of Use, together with natural extensions and evolutions thereof.",685,5.4112149533,24,2,2,1
"MD Anderson also hereby grants to Adaptimmune Limited an exclusive option to negotiate an<omitted>exclusive (subject to MD Anderson's perpetual, irrevocable, no-cost right to use such Invention for non-commercial internal research, academic and patient care purposes), royalty-bearing license to any Invention in which MD Anderson has an ownership interest, provided that Adaptimmune Limited pays all reasonably incurred patent expenses for such Invention in the event Adaptimmune Limited exercises its option.",510,6.4057971014,12,1,6,1
Cargill shall also grant a commercial license to Bioamber for Cargill Improvements and Joint Improvements under the terms and conditions of Exhibit D.,150,5.5652173913,1,1,2,1
"At Harpoon's sole election by written notice to AbbVie, AbbVie shall grant, and hereby grants to Harpoon, effective as of the effective date of termination, [***] (the ""AbbVie Reversion IP""); provided that the foregoing license shall exclude (1) any license or other rights with respect to any active ingredient that is not a Licensed Compound and (2) any license or other rights with respect to any other Patents or Know-How owned or controlled by AbbVie or any of its Affiliates.",481,5.025,16,5,7,1
"During the Term and subject to the limitations set forth in this Agreement, Naked shall have an exclusive right and license in the Territory to use Athlete's name, nickname, initials, autograph, image, likeness, photographs, biographical details, facsimile signature, voice, videos, electronic media depictions, any words, symbols or other depictions, as well as any other identifying attributes that would identify Athlete to the public, including any trade mark(s), copyrights which Wade has, as set forth on Schedule A attached hereto, and all multimedia assets that Wade owns or has right to use (collectively, the ""Wade Image"") solely for the advertising, endorsement, promotion, or sale of the Naked Products (including the Wade Products) in the Territory as follows:<omitted>(1) On Naked's website(s) (""Website""); (2) In social media channels, including, but not limited to Facebook, Instagram, Twitter, YouTube, Google+, Tumblr and other mutually agreeable channels, with reasonable frequency, to promote Naked Products and Wade Products; (3) In marketing and media opportunities in connection with the Wade Services (as defined below); and (4) For use on the packaging of the Naked Products and Wade Products and on Wade Products themselves.",1250,5.7621621622,63,1,4,1
"In addition, to the extent that it is legally able to do so, MD Anderson hereby grants LBIO a royalty-free right and license to use and reproduce any Publication.",162,4.6206896552,4,1,3,1
The right of usage described herein shall be subject to the requirement that the Company shall not place the Professional's Image in an unfavorable light.,154,5.2,2,3,1,1
"LICENSOR grants to plan_b a license to produce, use, distribute, promote and publicly display the Content in any possible way for distribution and marketing purposes.",166,5.68,4,0,2,1
"Subject to the approval process in Section 2, theglobe hereby grants to Boxlot a non-exclusive, worldwide license to use, reproduce, create derivative works of (only as necessary to build Co- Branded Pages), publicly display, publicly perform and digitally perform the Page Templates on Co-Branded Pages.",304,5.7777777778,12,1,2,1
"Miltenyi hereby grants to Bellicum, subject to all the terms and conditions of this Agreement, a limited non-exclusive right and license under the Miltenyi Technology incorporated or embodied in the Miltenyi Products supplied hereunder), solely to use such Miltenyi Products for the Permitted Use.",297,5.7727272727,6,2,3,1
"Emdeon is hereby granted a non-exclusive and worldwide right to use WebMD's trademarks and logos (""Marks"") for the purpose of identifying the origin of the Content during the term of this Agreement.",198,5.21875,7,1,3,1
