text,x1,x2,x3,x4,x5,y
"Commercial General Liability Insurance with a minimum combined single limit of liability of $1,000,000 per occurrence and $2,000,000 aggregate for bodily Injury, death, property damage and personal injury, and specifically covering infringement of Intellectual Property Rights. This policy shall include products/completed operations coverage and shall also include contractual liability coverage.",397,6.96,9,2,4,0
"Diplomat agrees that it will not at any time during the term of this Agreement or thereafter attack (i) KI, Inc.'s title to, or rights in and to, KI's name or (ii) the validity of this license.",193,4.2432432432,11,0,2,0
"Distributor hereby grants Zogenix an irrevocable, perpetual, world-wide, royalty-free, fully paid-up, non-exclusive license with the right to grant sublicenses under such Distributor Inventions and any patents or patent applications claiming or disclosing such Distributor Inventions.<omitted>Distributor shall own the entire right, title and interest in and to any and all Inventions discovered, developed, identified, made, conceived or reduced to practice solely by Distributor or its Affiliates or Sub-distributors or its other subcontractors in the Territory and under or in connection with this Agreement, including in the course of conducting regulatory activities or Commercialization of the Product in the Field in the Territory, whether or not patented or patentable, together with any and all intellectual property rights in any such Inventions, including Patents that claim or disclose any such Inventions (collectively, the ""Distributor Invention"").",962,6.2954545455,26,2,10,0
"Notwithstanding the foregoing, UTK may assign this Agreement or any portion of its Compensation as outlined herein to its subsidiaries in its sole discretion.",158,5.625,2,1,0,0
Any audit with respect to amounts payable by either party to the other party under this Agreement shall be limited to an audit with respect to amounts to be paid in the current calendar year and immediately preceding calendar year only.,236,4.7804878049,1,1,0,0
"With respect to the responsibility and allocation of costs for the enforcement of the Joint Patents (i) against Third Party products that infringe the Joint Patents outside the Ono Territory, or (ii)<omitted>against Third Party products in the Ono Territory that infringe the Joint Patents but that are not ""Infringing Products"", the Parties shall discuss and agree at the time when the Parties consult with respect to the strategy of such enforcement action in response to such Third Party infringement.",504,5.3924050633,9,1,0,0
"Notwithstanding anything to the contrary in Attachments A, G or H, in connection with any Change in Circumstances (as defined below), and without limiting Seller's/ExxonMobil Selling Affiliate's other rights under this Agreement or applicable law, Seller/ExxonMobil Selling Affiliates shall have the right: (i) only if required to enable Seller/ExxonMobil Selling Affiliate to comply with applicable laws and regulations, to terminate this Agreement and accelerate all amounts due from Buyer hereunder, making them immediately payable (ii) to modify the payment terms hereunder; and/or (iii) to require that Buyer/Buyer Affiliates pay in advance for shipments hereunder.",670,6.1382978723,19,4,2,0
"Subcontractor, during the term of this Agreement and for a period of one year thereafter, shall not, directly or indirectly, for itself or on behalf of or in conjunction with any other person, partnership, corporation, business or organization, solicit, hire, contract with or engage the employment of an employee of EDGE with whom Subcontractor or its personnel have contact as a result of Subcontractor's performance of this Agreement, unless Subcontractor (i) obtains the written consent of EDGE, as applicable, and (ii) pays EDGE as applicable a fee to be mutually agreed upon",580,5.3152173913,18,1,0,0
"If you are a partnership or limited liability partnership, then the partners of that partnership will not, without our prior written consent, admit additional general partners, remove a general partner, or otherwise materially alter the powers of any general partner.",267,5.7,6,0,0,0
"""Distributor Share"" means, with respect to Net Revenue, the percentage of Net Revenue that the Distributor is entitled to receive, as follows: (i) for the first ten (10) Products installed, 7.5% of Net Revenue, and (ii) for the eleventh (11th) Product installed and all Products installed thereafter, 15% of Net Revenue. Notwithstanding anything to the contrary contained herein, the 1 Source: WATER NOW, INC., 10-Q, 11/20/2019 Distributor Share with respect to the split of Net Revenue between Hydraspin and the Distributor with respect to any particular Production installation or group Product installation may be negotiated by Hydraspin and the Distributor and set forth in a separate written agreement between the Parties, and in such case, the Distributor Share set forth in the separate written agreement shall supersede and control over the Distributor Share set forth above.",883,5.5,29,2,0,0
"""The Vitamin Shoppe is the proud exclusive vitamin sponsor of drkoop.com.""",74,5.8181818182,4,0,1,0
"Upon the termination of this license, notwithstanding anything to the contrary herein, all royalties on sales theretofore made shall become immediately due and payable and no minimum royalties shall be repayable.",212,5.8709677419,3,3,1,0
This Agreement and performance hereunder shall be governed by the laws of the State of Oklahoma without regard to conflict of laws.,131,5.0,1,2,0,0
"In the event that the Company's Total Adjusted Capital for each of the Company's first and third fiscal quarters (as determined based on the Company's first and third fiscal quarterly filed statutory financial statements, respectively, subject to any adjustments or modifications thereto required by the Domiciliary State's insurance department or the Company's independent auditors) falls below the Specified Minimum Percentage of the Company's projected Company Action Level RBC (in each case as estimated by the Company as of the end of each such first and third fiscal quarters, as the case may be, taking into account (for purposes of such estimation) facts and circumstances occurring after the end of such fiscal quarter but before such time as AIG would be obligated pursuant to paragraph 3 to make a contribution), AIG shall, within the respective time periods set forth under paragraph 3, in accordance with paragraph 4 and in compliance with applicable law, provide to the Company cash, cash equivalents, securities or other instruments that qualify (as admitted assets) for purposes of calculating the Company's Total Adjusted Capital, as a contribution and not as a loan, in an amount such that the Company's Total Adjusted Capital as of the end of each of the Company's second and fourth fiscal quarter, as the case may be, will be projected to be at least equal to the Specified Minimum Percentage of the Company's Company Action Level RBC.",1455,5.2222222222,33,2,0,0
"King agrees that from and after the Promotion Commencement Date, the King Sales Force will be staffed with at least [***] full-time Sales Representatives (subject to vacancies consistent with average vacancy rate experienced by King across its total sales force) who are actively promoting the Product in accordance with the Launch Plan or Annual Plan (the ""Minimum Sales Force Level""); provided that King may meet such requirement to actively promote the Product by promoting the Product through P2 Details and P3 Details.",523,5.3902439024,10,0,0,0
"The term of this Agreement commences on the Effective Date and shall continue in effect until the later of (a) the fourth (4th) anniversary of the Effective Date, or (b) the completion or termination of the Research and receipt by LBIO of all deliverables due from MD Anderson hereunder, unless sooner terminated in accordance with the provisions of Section 2.2 or Section 9.14.",378,5.0158730159,11,5,0,0
"Pursuant to Section 4 and Schedule 1 of the Agreement, Service Provider and Service Recipient agree that the amount of the Service Fee for the [•] quarter of 20[•] shall be [RMB [•] ([•][in letters]) in total]/[set at [•]% of the revenues booked by Service Recipient during the quarter, amounting to RMB [•] ([•][in letters])].",327,4.9636363636,7,2,0,0
"""Effective Date"" has the meaning of the ""Closing Date"" set forth in the Investment Agreement.",93,5.2666666667,5,1,0,0
"Neither you nor any of your owners, principals, or other persons acting on your behalf will directly or indirectly contest the validity or our ownership of the Proprietary Marks, nor will you, directly or indirectly, seek to register the Proprietary Marks with any government agency (unless we have given you our express prior written consent to do so).",353,5.1034482759,8,0,0,0
"CERES will not unreasonably withhold its consent for research programs with respect to GERMPLASM IMPROVEMENT of COLLABORATION CROPS with academic institutions in the European Union under United Kingdom government or European Union funding, provided that (i) IGER will have the exclusive right to use and exploit commercially the results of such research programs obtained by IGER, (ii) no COLLABORATION CROP germplasm will be made available by IGER to any third party for selection, breeding or propagation work, or for genetic transformation of such germplasm, except that IGER may make available germplasm of CERTAIN MISCANTHUS ACCESSIONS for research purposes (including breeding), subject to the terms and conditions under which IGER holds such accessions, and (iii) if requested by CERES, IGER will use reasonable efforts to obtain commercialization rights for CERES on results<omitted>obtained by third parties in such collaborative research programs or breeding activities.",980,5.9084507042,17,0,3,0
"In the event that Developer fails or refuses to obtain or maintain the required insurance coverage from an insurance carrier acceptable to El Pollo Loco, Franchisor may, as its sole and absolute right and without any obligations to do so, procure such coverage for Developer.",275,5.1333333333,4,1,1,0
"In no event will either Party be liable to the other Party under this Agreement for any consequential, indirect, special, incidental, punitive or exemplary loss or damage, including, without limitation, business interruption, cost of capital, loss of anticipated revenues and profits, loss of goodwill or increased operating costs, whether arising from contract, warranty, tort, strict liability or otherwise regardless of whether the possibility of such losses or damages have been made known to the first Party, and each Party hereby expressly waives all such rights and remedies, except for breach of any confidentiality or restricted use provisions of this Agreement and except as provided in Paragraph 11.04 (Exceptions to Limitations of Liability).",754,5.7410714286,20,3,1,0
"Todos shall ship ordered Products to the Reseller within ninety (90) days of Todos's acceptance of the applicable purchase order DAP Reseller's warehouse (Incoterms 2010), provided that Reseller's order for the Products does not deviate from the applicable Forecast by more than ten percent (10%).",297,5.6222222222,11,1,0,0
Transporter shall be obligated to provide such minimum pressures only to the extent that capacity is reserved by Shipper and scheduled by Transporter at the Primary Delivery Point(s) described above.,199,5.6666666667,3,1,0,0
"IN NO EVENT WILL EITHER PARTY BE LIABLE FOR ANY INCIDENTAL, SPECIAL OR CONSEQUENTIAL DAMAGES RESULTING FROM THE LICENSE GRANTED PURSUANT TO THIS AGREEMENT OR THE USE OR COMMERCIAL DEVELOPMENT OF PRODUCT.",203,5.375,2,1,2,0
All sales towards customers for bunker fuel will be carried out exclusively by Bunker One in accordance to the terms set forth herein.,134,4.8695652174,1,1,0,0
LKPL shall have the exclusive right to market and sell AMR Product Suites to entities whose corporate headquarters are physically located outside the United States and its territories.,184,5.6071428571,1,1,2,0
FIIOC may terminate this Agreement at any time upon ninety (90) days' written notice to Company.,96,5.0625,4,0,0,0
This Agreement shall be construed and enforced in accordance with and governed by the laws of the State of Massachusetts.,121,5.1,1,1,0,0
The foregoing Licensed Patents and Licensed Technical Information shall not include the right to sublicense the Licensed Patents and Licensed Technical Information without the prior written consent of Liquidmetal. F,215,6.2,1,1,6,0
"Vyera shall have the right to terminate this Agreement in its entirety:<omitted>(c) at any time following the second (2nd) anniversary of the First Commercial Sale of the Licensed Product, for any reason or no reason, upon one hundred eighty (180) days' written notice to CytoDyn.",280,5.2444444444,11,1,2,0
"The ownership, and all goodwill from the use, of any Dova Trademarks and Copyrights shall at all times vest in and inure to the benefit of Dova, and Valeant shall assign, and hereby does assign, any rights it may have in the foregoing to Dova.",243,4.4222222222,6,3,1,0
"Merchant shall deliver to Purchaser certificates evidencing such insurance, setting forth the duration thereof and naming Purchaser as an additional insured or loss payee, as applicable, in form and substance reasonably satisfactory to Purchaser.",246,6.2647058824,4,2,0,0
"In accordance with items 9.3, 9.4, and 10.3, this Contract shall come into force on the Effective Date, remain effective throughout the Initial Term, and be prolonged, or further extended automatically for a period of 12 months, each such extension commencing at the end of the last day of the Initial Term or the relevant anniversary thereof, unless either Party serves written notice of termination on the other Party at least 65 days prior to the end of the Initial Term, or any subsequent extension.",503,4.9294117647,13,4,0,0
"Similarly, if a third party (who is not an affiliate of Playa) approaches Playa during the Development Term with a proposed offer or arrangement, which Playa desires to accept, under which Playa or its affiliate would manage an all- inclusive resort in the Market Area for that third party, and if that third party has not then already designated a brand under which that all-inclusive resort would operate, then Playa agrees to provide notice to Hyatt and introduce Hyatt to that third party for purposes of enabling Hyatt (at its option) to negotiate for the opportunity to provide that third party franchise rights to brand that resort as a Hyatt All-Inclusive Resort.",671,5.0,13,0,1,0
"If Monsanto does contest the occurrence of the alleged Brand Decline Event by submitting such alleged Brand Decline Event to resolution through arbitration in accordance with the provisions of Section 10.4(g) of this Agreement within ninety (90) days of receipt of such notice from the Agent, then the question of whether a Brand Decline Event has occurred will be finally determined in accordance with the provisions of Section 10.4(g) of this Agreement, and if a Brand Decline Event is finally determined to have occurred, then the Brand Decline Event shall be deemed to have occurred as of the date of such notice, and thereafter the Agent shall be entitled to either, as the Agent's sole remedy, (x) terminate this Agreement, which termination shall be effective at the end of the third (3rd) full Program Year following the Program Year in which the Agent delivers notice of termination pursuant to this Section 10.5(d)(iii), or (y) not terminate this Agreement and be entitled to the Additional Commission Amount (in addition to the Commission) set forth in Section 10.5(d)(iv) below, which Additional Commission Amount shall be subject to all other terms and conditions of this Agreement with respect to the Commission, except as otherwise expressly stated in this Section 10.5(d).",1288,5.2270531401,41,8,0,0
"At least […***…] during the time a Work Stream remains in effect, unless otherwise agreed by the Parties, FMI shall have the obligation to prepare and provide to the JRDC a summary presentation on the progress of the work performed by FMI in the course of each Work Stream during the preceding […***…].",302,4.7169811321,3,1,0,0
"Within seventy-five (75) days following the end of each month of a calendar year during the Term that ""BCF"" (as defined below) for such month, when combined with BCF for all prior months during such calendar year (other than any month which is outside the Term) is less than the Minimum BCF, Nexstar shall pay a fee to WYZZ in an amount equal to thirty-five percent (35%) of BCF for such month. Within seventy-five (75) days following the end of each month of a calendar year during the Term that BCF for such month, when combined with BCF for all prior months of such calendar year (other than any month which is outside the Term) is greater than the Minimum BCF, Nexstar shall pay a fee to WYZZ in an amount equal to 50% of BCF for such month; provided, in the first month of each calendar year in which this sentence applies, the fee with respect to the portion of BCF for such month which, when combined with BCF for all prior months during such year (other than any month which is outside the Term) is exactly equal to the Minimum BCF, shall equal thirty-five percent (35%) of such portion rather than fifty percent (50%).",1127,4.4757281553,35,3,0,0
"Both parties must also (1) make and keep books, records and accounts, which, in reasonable detail, accurately and fairly reflect the transactions and dispositions of assets of the company, (2) devise and maintain a system of internal accounting controls, and (3) at any time a party so requests in writing, but no more than once a year, grant to the other party commercially reasonable access to said books, records, systems and accounts to verify compliance.",459,5.1333333333,17,0,1,0
"Thereafter, Bellicum shall have consecutive separate options to extend the Term for successive renewal terms of five (5) years each (each, a ""Renewal Term"", and<omitted>collectively with the Initial Term, the ""Term"").",217,6.0322580645,13,1,0,0
"MacroGenics may terminate this Agreement immediately upon written notice to Green Cross in the event Green Cross or any of its Affiliates: (a) directly or indirectly oppose, or assist any Third Party to oppose, in any patent office proceeding, the grant of any patent or patent application within the MacroGenics Licensed Patents, or, in any patent office proceeding, dispute or directly or indirectly assist any Third Party to dispute, the validity of any patent within the MacroGenics Licensed Patents or any of the claims thereof, including opposing any application for amendment thereto;<omitted>(b) directly or indirectly oppose, or assist any Third Party to oppose, in any court proceeding, the grant of any patent or patent application within the MacroGenics Licensed Patents, or, in any court proceeding, dispute or directly or indirectly assist any Third Party to dispute, the validity of any patent within the MacroGenics Licensed Patents or any of the claims thereof; or (c) bring any claim or proceedings of whatever nature in relation to the MacroGenics Licensed Patents against MacroGenics and/or any of MacroGenics' Affiliates (or in respect of the foregoing their directors and officers) in respect of any activities carried out by them under any MacroGenics Licensed Patents which may be the subject of a Valid Claim of the MacroGenics Licensed Patents.",1370,5.4065420561,28,2,17,0
"No action, regardless of form, related to, or arising out of this Agreement may be brought by either party more than two (2) years after the cause of action has arisen.",168,4.4516129032,6,0,0,0
We will be named an additional insured in such policy or policies.,66,4.5833333333,1,0,0,0
"Licensee agrees and covenants that it shall not challenge, contest, or take any actions inconsistent with Licensor's exclusive rights of ownership of the Licensed Mark.",168,5.76,4,1,5,0
"During the Term of this agreement, and for a period of twenty four (24)months after Termination (the ""Withholding Period""), Contractor may retain monies (collections in Accounts Receivable) against any reasonable anticipated deductions for product recalls, unsalables, rebates, allowances or any audits or other adjustments it deems necessary.",343,6.3191489362,14,0,0,0
"You agree that all other data that you create or collect in connection with the System, and in connection with your operation of the Franchised Business (including customer lists and transaction data), is and will be owned exclusively by us during the term of, and after termination or expiration of, this Agreement.",316,5.0961538462,7,0,0,0
"Upon completion of such inspection, PPI shall not be entitled to inspect nor shall EKR be required to make available the records and books for any Calendar Year for which such inspection was previously undertaken.",213,5.1142857143,2,2,0,0
"This Agreement shall inure to the benefit of and be binding upon the successors and assigns of the Parties hereto; provided, however, that neither Party shall transfer or assign this Agreement without the prior written consent of the other Party, such consent not to be unreasonably withheld, except where such assignment is by CPDC to any successor or subsidiary organization created within [***] of the Effective Date of this Agreement, which assignment may be completed without the prior written consent of FUSION.",517,5.3170731707,7,5,0,0
"IN NO EVENT SHALL EITHER FMI OR ROCHE BE LIABLE FOR SPECIAL, INDIRECT, INCIDENTAL OR CONSEQUENTIAL DAMAGES ARISING OUT OF THIS AGREEMENT BASED ON CONTRACT, TORT OR ANY OTHER LEGAL THEORY.",187,5.064516129,4,1,0,0
"After the bad debt provisions and the part allocated to the fee collection agent are deducted from the total revenue, Party B will obtain 40% of the remaining revenue (total revenue * (1 - bad debt rate) * (1 - sharing percentage for fee collection channel) * 40%)",264,4.5208333333,9,1,0,0
"The construction, interpretation and performance of this Agreement shall be governed by the laws of Switzerland, except for its conflicts of law principles.",156,5.8260869565,3,1,0,0
"The Industrial Property Rights on the Results, as well as the Intellectual Property Rights realized in the research activities covered by this JV, are due jointly to the parties in equal shares (50% for each Party), without prejudice to the possibility of agreeing in writing, during the course of every specific activity, about the modification of the respective shares of co-ownership, based upon the actual contribution of each of the Parties to the research activities, and also without prejudice to the recognition of the intellectual rights due to each inventor pursuant to current legislation.",600,5.3936170213,11,1,7,0
"Bellicum acknowledges and agrees that Bellicum's rights to a refund or credit for, or to receive replacement of, properly rejected shipments of Miltenyi Products hereunder shall be Bellicum's sole and exclusive remedy, and Miltenyi's sole obligation, with respect to non-conforming Miltenyi Products delivered hereunder.",320,6.2954545455,9,3,2,0
Company's representatives will make themselves available three days per month in the first Product Year to consult with and train Distributor.,142,5.8095238095,2,0,0,0
"If, after the date of this Agreement and continuing as long as either Party is a partner, member, or shareholder of the Operating Company, such Party or any of its Affiliates receives or discovers any opportunity within the Field of Agreement, including without limitation developing or completing the development of, or discovering, or acquiring proprietary rights over, a product or process that falls within the Field of Agreement, the Operating Company then shall have exclusive rights to exploit such opportunity, but only within the Field of Agreement.",558,5.4252873563,11,1,3,0
"For avoidance of doubt, all audits under this Section shall be conducted solely by an independent public accountant as described in the foregoing sentence.",155,5.5,2,1,0,0
"""Offtake Agreement"" means that certain Crude Oil Sale and Purchase Agreement between the Principal and STASCO dated 1 November 1999.",132,5.65,3,0,0,0
"EFS shall provide, at its sole expense:<omitted>(b) A copy of EFS' Independent Auditors' Report and audited balance sheet for each Year of the Term within thirty (30) days of the close of such audit.",199,4.8823529412,9,1,0,0
Sponsor shall provide SDBF with certificates of insurance evidencing compliance with all insurance provisions noted above prior to the commencement of the sponsorship and annually prior to the expiration of each required insurance policy.,238,6.0294117647,1,2,0,0
"In addition to the royalty provided in Article 4.2, CERES agrees to pay a royalty on NET SALES of the LICENSED VARIETY equal to the royalty due, on the basis of the Convention on Biological Diversity, by IGER to the country or countries where the material on which the LICENSED VARIETY is based has been collected, up to a maximum of [***] percent ([***]%) of NET SALES, and an equivalent additional royalty on LICENSE INCOME to be determined.",443,4.6923076923,9,0,7,0
"VerticalNet shall register and own the domain name and the URL used in connection with the Co-Branded Career Center, subject, however, to Neoforma's agreement on the name to be used for the URL, which domain name and URL shall be mutually agreed upon by the Parties.",266,4.8043478261,7,2,0,0
The term of this Agreement will begin on the Effective Date and will end on the second (2nd) anniversary of the Commencement Date.,130,4.6956521739,3,1,0,0
