text,x1,x2,x3,x4,x5,y
"Solely for this purpose, NETGEAR and Bay Networks grant Distributor a non-exclusive, royalty-free, limited right to use the Trademarks.",135,6.1578947368,6,0,4,1
"Subject to the terms and conditions of this Agreement, Google grants to Distributor a limited, [ * ] license during the Term to use the Google Trademarks, in accordance with Google's trademark usage guidelines, solely to market and promote the Products consistent with this Agreement, provided that all use of the Google Trademarks shall be subject to Google's prior review and advance written consent.",402,5.296875,8,1,2,1
"FMI hereby grants to Roche a non-exclusive, royalty-free, worldwide, perpetual, and sublicensable license to any intellectual property arising from the Immunotherapy Testing Platform Program Controlled by FMI for internal research purposes and to the extent necessary for Roche to research, develop, make, have made, use, offer for sale, sell, import and commercialize Roche products other than diagnostic products.",415,6.1724137931,14,1,5,1
"Accuray hereby grants to Customers of Products a non-exclusive, non-transferable and royalty-free license under any Patents owned by Accuray or the licensing of which is controlled by Accuray that, but for this license, would be infringed by the use of such Products in accordance with the applicable Specification.",315,5.5833333333,7,1,4,1
"During the Term, subject to the terms and conditions of this Agreement, Dova hereby grants to Valeant the right, on a co-exclusive basis (solely with Dova and its Affiliates), to Detail and promote the Product in the Specialty in the Territory in the Field, and to conduct the Valeant Activities and the activities of the institutional account management team (pursuant to and subject to the terms of Section 4.1.5) for the Product in the Territory in the Field in accordance with the terms and conditions of this Agreement.",524,4.9659090909,13,2,2,1
"We grant to you, upon the terms and conditions contained in this Agreement, the exclusive right to establish and operate a Franchised Business and a license to use the methods, procedures and products developed by us in the business of selling and servicing Unit Franchises in the territory described on Attachment A attached to this Agreement and incorporated into this Agreement by reference (the ""Master Territory"").",419,5.3636363636,8,0,4,1
"Agent hereby grants to Monsanto, during the term of this Agreement, a non-exclusive, royalty-free, non- transferable and non-assignable license (without the right to sublicense, except as specifically set forth in Section 6.11(h)) to use the Additional Roundup Products Trademarks for the purpose of and to the limited extent necessary to register the Additional Roundup Products with federal, state, or territorial government authorities (as may be required by law) in the United States and its territories (the ""Additional Roundup Products Trademarks<omitted>License"").",571,6.15,23,1,6,1
"Magenta grants to Bachem a limited, non-exclusive license to use any Magenta Developed Intellectual Property to manufacture and release the Product for Magenta in accordance with the terms and conditions of this Agreement and any applicable Project Plan.",254,5.7105263158,3,0,4,1
"Subject to the terms and conditions of this Agreement, JRVS appoints the Distributor, and the Distributor hereby accepts such appointment, as JRVS'S non-exclusive authorized distributor for sale of the Products to the Customers (other than House Account) in the Territory (as these terms are defined in Section 1.8, above).",323,5.612244898,12,1,1,1
"Subject to the terms and conditions of this Agreement, Cisco Systems, Inc. or its subsidiary licensing the Software instead of Cisco Systems, Inc. (""Cisco""), grants to Customer a nonexclusive and nontransferable license to use for Customer's internal business purposes the Software and the Documentation for which Customer has paid the required license fees.",358,5.7735849057,12,0,2,1
"For greater certainty, ""New Technology"" shall exclude any (x) modification to Philips pre-existing Intellectual Property Rights (which, shall exclude any Intellectual Property Rights forming part of the ""Purchased Assets"" under the Purchase Agreement) and (y) developments developed not for the Products (collectively, ""Philips Retained Product IP'), provided that Philips and its Affiliates hereby grant to Customer under any such Intellectual Property Rights, which are applicable or used for the manufacturing of the Product, a non- exclusive, non-transferable (except in accordance with clause 18.4 (Assignment)), irrevocable, world-wide, fully paid-up license, without the right to grant sub-licenses, to make, have made, sell or commercialize in any other way the Product.",778,6.212962963,40,4,14,1
ALFA AESAR hereby grants to NTC a limited non-exclusive license to use the ALFA AESAR Trademarks in the form provided by ALFA AESAR during the Term of this Agreement in accordance with the terms set forth herein.,212,4.7567567568,2,2,2,1
Distributor shall only distribute or sell the Products to customers who are licensed health care professionals and meet the other requirements set forth in Exhibit B.,166,5.4230769231,1,1,1,1
"ENERGOUS hereby grants DIALOG a non-exclusive, non-transferable (except as set forth in Section 2) license under the Product IP to use any of the Deposit Materials released from escrow for the purpose of fixing an Epidemic Defect or other Product design or production issue impacting yield or quality during the Term and, if applicable, any Wind Down Period or Continuing Obligation period, including, but not limited to, authorizing any third party subcontractor to manufacture and supply Products, provided, however, that DIALOG continues to make all Royalty payment owed to ENERGOUS (or the then-current owner of the Product IP) as provided in this Agreement.",662,5.4368932039,17,1,3,1
"If, for any reason, [***], both Microgenics and the Back-up Supplier (as applicable) are unable to supply the Assay in quantities sufficient to meet the quantities of the Assay either (a) as set forth in each applicable Binding Forecast or (b) based on such other measure of commercial demand as agreed to by the Parties in writing, in either case, during any given [***] ([***]) month period for a given country in the Territory, then Microgenics hereby grants Achaogen or its designee a Shortfall License, which license shall survive until [***] ([***]) months following the date that either Microgenics or the Back-up Supplier (as applicable) is in a position again to fulfill such demand (as such positioning is demonstrated [***]) (the ""Supply Resumption Date"").",767,5.1935483871,28,2,2,1
"Upon the Effective Date, AbbVie hereby grants to Harpoon a non-exclusive, royalty-free license, without the right to grant sublicenses (other than to permitted subcontractors of Harpoon in accordance with Section 3.7), under the AbbVie Patents, AbbVie Know-How, and AbbVie's interests in the Joint Patents and the Joint Know-How, to Develop and Manufacture the Licensed Compounds or Licensed Products in the Territory solely to the extent necessary for Harpoon to perform its obligations as set forth in, and subject to, the Initial Development Plan.",550,5.6385542169,18,3,7,1
"The sublicense rights granted to Equifax pursuant to Section 4.4(a) include the right for Equifax to grant sublicenses to the Licensed Certegy Materials (excluding the Utility<omitted>Software Programs) to the members of the Equifax Group, which sublicenses may include the right to further sublicense such Licensed Certegy Materials (excluding the Utility Software Programs) to such Group member's customers solely for each such customer's internal business purposes to the extent related to the Equifax Business.",514,6.0547945205,11,1,9,1
"In reliance upon the application and information furnished by the Franchisee, and subject to the terms and conditions contained in this Agreement, BKC grants to the Franchisee a license to use the Burger King System and the Burger King Marks in the operation of a Burger King Restaurant at that Location.",304,4.9803921569,3,0,1,1
"Roche hereby grants to FMI a non-exclusive, royalty-free, worldwide and perpetual license, sublicensable to Affiliates, to use the Roche-Owned Advanced Genomic Analysis Results to develop, make, have made, use, offer for sale, sell, import and commercialize FMI's products and services relating to genomic analysis.",315,6.1818181818,15,1,3,1
"The grant of rights and license pursuant to this Section 1 shall include, but not be limited to, the right of ConvergTV to Distribute and re-Distribute all or any portions of the Program and Promotional Works, including excerpts therefrom, and any new and different versions of the Program, on simultaneous internet transmission or streaming, internet protocol television and any television networks and stations, and/or other distribution outlets, via domestic or foreign television signals, as well as through CATV and DBS systems, satellite, microwave, fiber optic and/or other modes of Distribution yet to be developed, but which may be utilized by ConvergTV in the future.",677,5.5192307692,15,2,4,1
"Pursuant to the Subscription Agreement, CHT shall obtain from each End User the right to and hereby grants, effective upon the execution and delivery of such End User's Subscription Agreement, to Ehave: (i) a royalty-free, non-exclusive, non-transferable, limited right and licence during the term of such Subscription Agreement to use, copy, store and display the End User Data solely for the purpose of enabling Ehave to operate the Ehave Companion Solution for such End User and as may be necessary for the purpose of enabling Ehave to provide support services in accordance with this Agreement; and (ii) a royalty-free, non-exclusive, limited, perpetual right and license to use, copy, store and display End User Data on an aggregated and anonymous basis and so as not to permit the identification of any End User or individual for the sole purpose of improving or developing enhancements to the Ehave Companion Solution , provided that Ehave shall not have any right to use, commercialize or exploit such End User Data in any other manner or for any other purpose.",1069,5.1142857143,28,5,9,1
"Endorser also grants to MusclePharm and consents to MusclePharm's editorial use world-wide of Endorser's Name and Appearance in MusclePharm published materials approved by Endorser. For purposes of this Agreement, MusclePharm's editorial use of Endorser's Name and Appearance shall mean a use that does not directly promote, advertise or endorse MusclePharm's business, its Products or Licensed Products. Nothing in this Section 6(c) shall entitle MusclePharm to reduce Endorser's compensation pursuant to Section 7 and Section 8 of this Agreement (including, without limitation, with respect to any renewal Term, if any).",622,6.0,20,3,1,1
"New Process Technologies that have been developed by Eutectix, alone or with a third party, shall be solely owned by Eutectix, and, if permitted, Eutectix shall grant Liquidmetal a license to such New Process Technologies as set forth in Section 8.3 below.",256,5.119047619,7,2,2,1
"The Company hereby grants the Distributor the right to do business and use the name ""Electric City of Illinois"" or a similar variation thereof (collectively the ""Names"") for use under this Agreement.",199,5.25,7,2,1,1
"Aimmune covenants that it will not research or develop (including Develop) the Antibody itself, including not developing any modification, variant, fragment, progeny or derivatives of such Antibody, in each case, in a way that would produce a molecule that is neither the Antibody nor a molecule that falls within the definition of a Product.",342,5.3518518519,9,0,0,1
"Subject to the terms and conditions of this Agreement, Arizona hereby grants to the Company a perpetual, non- exclusive, royalty-free license in, to and under the Arizona Licensed Copyrights for use in the Company Field throughout the world.",241,5.3684210526000005,7,1,4,1
"Subject to the terms and conditions of this Agreement, Zogenix hereby grants to Distributor an co-exclusive, royalty-free, limited right under the Product Trademarks solely to promote, market, sell, offer for sale, import, package and distribute the Product in Field in the Territory in accordance with the terms of this Agreement.",331,5.64,11,1,3,1
"VerticalNet hereby grants to Neoforma a non-exclusive, non-transferable license to use, reproduce, display and transmit the VerticalNet Content, solely in connection with the operation of the Neoforma Site, subject to and in accordance with the terms, conditions and provisions of this Agreement.",296,6.0714285714,9,2,2,1
"The parties hereby grant to each other non-exclusive, fully-paid, royalty-free licenses to utilize the other party's trademarks, as follows: (a) Biocept Trademarks. To facilitate the promotion and performance of Tests, during the Term Biocept hereby grants Life Technologies a non-exclusive, royalty-free, non-transferable license to use the Biocept Trademarks solely for<omitted>use in connection with the promotion and performance of the Tests in the Territory.",463,6.3650793651,18,2,6,1
"Boxlot hereby grants to theglobe a non-exclusive, worldwide license to use, reproduce, create derivative works of (only as necessary to build pages in a manner consistent with this Agreement), publicly display, publicly perform and digitally perform Boxlot Banners, and those elements of the Boxlot Content served from theglobe's servers (as denoted in Exhibit A), on theglobe Site or otherwise as reasonably appropriate to advertise and promote the Service and the Co-Branded Pages.",483,5.7222222222,15,1,2,1
"Upon the terms and conditions set forth in this Agreement, KI, Inc. hereby grants to Diplomat and Diplomat hereby accepts the right, license and privilege of utilizing KI's name and likeness solely upon and in connection with the manufacture, sale and distribution of the following products: (1) sunglasses, eyeglasses, readers and ophthalmic frames;<omitted>(2) optical cases, optical eye chains, eye pins, and lens cleaning kits sold only in optical retailers; and (3) such other optical accessories as the parties shall agree.",529,5.625,21,3,2,1
"Tripath grants to Distributor a non-exclusive license to use Tripath's trademarks, trade names and service marks only in connection with the Products and in the performance of Distributor's obligations under this Agreement.",223,6.0,5,1,2,1
"To the extent any Development owned by Life Technologies relates directly to the practice of, or constitutes an improvement to, the Assay, Life Technologies hereby grants to Biocept, during the Term of this Agreement, and, except in the case of termination of this Agreement by Life Technologies for Biocept's uncured material breach, after expiration or termination of this Agreement, a non-exclusive, worldwide, royalty-free, fully-paid license, including the right to sublicense, under Life Technologies' Intellectual Property Rights in such Developments, solely to develop, make, have made, use, sell, have sold, offer for sale, import, perform and provide the Assay.",671,5.8571428571,28,2,8,1
"Subject to the terms and conditions of this Agreement, SIGA hereby grants to MMT an exclusive right and license, with the right to grant sublicenses as permitted under Section 2.1(b), under the SIGA Intellectual Property solely to Promote the Product in the Field in the Territory.",281,5.1304347826,7,1,7,1
"T&B hereby grants to LEA, and LEA hereby accepts from T&B, during the Term, the sole and exclusive worldwide right and license in and to the Licensed Intellectual Property, which right and license shall be limited to that which is necessary for LEA to (i) develop and create Educational Materials and (ii) develop, promote and conduct the Business worldwide , unless the license is earlier terminated as provided herein.",420,5.1014492754,11,4,9,1
You further acknowledge and agree that we and our affiliates have the right to charge a reasonable systems fee for software or systems installation services; modifications and enhancements specifically made for us or our affiliates that are licensed to you; and other maintenance and support Computer System-related services that we or our affiliates furnish to you.,366,5.5535714286,4,0,2,1
"Unless otherwise agreed in an Order, Supplier grants Bank of America a perpetual, worldwide, irrevocable, nonexclusive royalty free license to any Pre-existing IP embedded in the Work Product, which shall permit Bank of America and any transferee or sublicensee of Bank of America, subject to the restrictions in this Agreement, to make, use, import, reproduce, display, distribute, make derivative works and modify such Pre-existing IP as necessary or desirable for the use of the Work Product.",495,5.5263157895,16,1,2,1
"Subject to the terms and conditions of this Agreement, Application Provider hereby grants to Excite@Home a royalty-free, non-exclusive, worldwide license to use, reproduce, distribute, transmit and publicly display the e-centives Content in accordance with this Agreement and to sub-license the Application Content to Excite@Home's wholly-owned subsidiaries or to joint ventures in which Excite@Home participates for the sole purpose of using, reproducing, distributing, transmitting and publicly displaying the e-centives Content in accordance with this Agreement, provided that no such sublicensing shall be to Application Provider Named Competitors.",652,6.5930232558,18,2,4,1
"You hereby grant to us (and agree to obtain from your affiliates, owners, employees, and/or contractors), a perpetual, non-exclusive, and worldwide right to use any such ideas, concepts, methods, techniques and products in any businesses that we and/or our affiliates, franchisees and designees operate. We will have the right to use those ideas, concepts, methods, techniques, and/or products without making payment to you. You agree not to use or allow any other person or entity to use any such concept, method, technique or product without obtaining our prior written approval.",581,5.4666666667,22,1,4,1
"Subject to the terms and conditions of this Agreement, Google grants to Distributor a [* ] license during the Term to: (a) bundle the Distribution Products, in machine-readable binary code format only, solely with Distributor App(s); (b) distribute Bundles directly (or indirectly, subject to Clause 2.2 (Third Party Distribution)) to End Users in the Territory; (c) when indicated by the applicable Criteria Checker and requested by the End User in accordance with clause 3.2 (Form of Distribution Offering), install the Chrome Browser or the Google Toolbar (as applicable) on the End User's system using the Google Installers; and (d) reproduce (or have reproduced by Third Party Distributors as defined in Clause 2.2 (Third Party Distribution)), the Distribution Products to the extent necessary to exercise the rights granted in (a), (b) and (c).",850,5.446969697,45,0,3,1
"You acknowledge that your right to use the Marks is derived solely from this Agreement, and is limited to your operation of the Franchise pursuant to and in compliance with this Agreement and all applicable standards, specifications, and operating procedures we prescribe from time to time during the term of the Franchise.",323,5.2307692308,4,1,1,1
"In the event that ExxonMobil fails to notify FCE before the end of the Term of the Agreement of ExxonMobil's intent to negotiate a subsequent or follow-on commercial agreement, ExxonMobil agrees to negotiate a grant to FCE, under commercially reasonable terms to be determined in good faith, a worldwide, royalty-free, non-exclusive, non-sub-licensable (except as set forth herein) right and license to practice ExxonMobil Background Information and ExxonMobil Background Patents for Generation 1 Technology in Carbon Capture Applications.",539,6.012987013,15,1,5,1
"PPI hereby grants EKR the exclusive right and license (with the right to sublicense) to use, market, promote, sell, distribute and warehouse the Products (the ""Distribution Rights"") in the Field in the Territory during the Term, as well as to make or have made the Products anywhere in the world for import or sale in the Field in the Territory in each case, under the PPI IP provided that PPI retains all rights necessary to manufacture and supply the Products to EKR in accordance with this Agreement and the Supply Agreement.",528,4.8131868132,13,1,7,1
"In the alternative, if LICENSOR is not the sole and exclusive owner of all of the foregoing intellectual property rights to the Content, LICENSOR has been granted by the owner or rightful sub-licensee of the intellectual property of the Content the right to grant the rights provided by LICENSOR to plan_b under this Agreement.",327,5.0740740741,4,0,14,1
"Licensed Products may not be sold to any customer in, or to any customer for distribution into, the following countries, without Liquidmetal's prior written consent, which consent shall not be unreasonably withheld, conditioned or delayed: Brunei, Cambodia, China (P.R.C and R.O.C.), East Timor, Indonesia, Japan, Laos, Malaysia, Myanmar, North Korea, Philippines, Singapore, South Korea, Thailand and Vietnam.",410,6.2105263158,28,1,1,1
Reseller grants to TouchStar a right and license to use the Reseller Marks in the preparation of the Private Label Software.,124,4.9523809524,1,0,2,1
"It is understood that Company may not use the Duval Identification in connection with any items for sale or resale, other than Company Products as specified herein.",164,5.1111111111,2,1,0,1
"Customer hereby grants to Manufacturer a non-exclusive license during the Term to use any Customer Property and Customer-Owned Improvements and Developments solely in connection with Manufacturer performing its obligations under this Agreement or the Facility Addendum in accordance with the terms hereof or thereof, as applicable.",331,6.2173913043,4,4,3,1
theglobe hereby grants to Boxlot a nonexclusive license to use such code solely to permit theglobe or its designee to serve ads in connection with the Co-Branded Pages.,168,5.0357142857,2,1,1,1
"License Grant. Subject to the terms and conditions of this Agreement, WGT grants to Distributor a nontransferable license to do the following in the Territory during the Term: (a) market and distribute the Product to resellers; (b) demonstrate the Product to potential resellers; (c) use the Product internally for the sole purpose of providing this product support specified in paragraph 4.1(c); (d) use and display the Trademarks in connection with marketing and distributing the Product in the Territory pursuant to paragraphs (a) and (b) above.",548,5.4588235294,22,1,3,1
You agree that we have the right to use your data as part of our earnings claim in our Franchise Offering Circular.,115,4.2727272727,1,0,1,1
"VerticalNet hereby grants Neoforma an exclusive license, even as to<omitted>VerticalNet, to use, modify, enhance, reproduce, display, perform and transmit the VerticalNet Medical Product Listings, subject to and in accordance with the terms, conditions and provisions of this Agreement, to the extent that VerticalNet has the right to do so.",341,5.9795918367,11,2,3,1
"You agree to use the Marks as the sole trade identification of the Franchise, except that you will display at the Franchise location a notice, in the form we prescribe, stating that you are the independent owner of the Franchise pursuant to a Franchise Agreement with us.",271,4.7872340426,4,1,0,1
Programmer shall not separately sell advertising time on the HD2 Channel but may market the WLIB Programs as being rebroadcast on the HD2 Channel.,146,5.125,1,1,0,1
"Each party hereby grants to the other a non-exclusive, limited royalty-free license to use its trademarks, service marks or trade names only as specifically described in this Agreement.",185,5.6428571429000005,5,1,3,1
"Producer further grants to ConvergTV the right and license to create (re-edit), at its sole cost and expense, new and different versions of the Program, create foreign language, subtitled or translated versions of the Program as well as to create closed captioned versions of the Program, including NTCS, PAL, SEACAM standards, or other standards, including those yet to be developed.",384,5.4166666667,13,0,2,1
"To the extent that certain components of the Software may be downloaded to Customer's or User's computer as a result of accessing the Software as part of the Hosting Services, eGain grants Customers a non-exclusive, non-transferable, limited license, with right to sublicense solely to Users, to use such Software only in connection with the Hosting Services.",359,5.4285714286,10,0,4,1
"The Professional hereby grants an exclusive, worldwide license to the Company to use the name, likeness, image and personal identification of the Professional, during the Term and for a period of six (6) months after the Term as provided in Section 2.8, in connection with the creation, manufacture, marketing, sale and promotion of the Products.",346,5.3090909091,12,1,2,1
The Intellectual Property granted to Party B shall only be used to the scope of Party B's Business operated by Party B.,119,4.4545454545,2,1,3,1
